{
  "contractVersion": "orion.research.v1",
  "researchRunId": "11111111-1111-4111-8111-111111111111",
  "queries": [
    {
      "query": "research methods",
      "provider": "google_news"
    }
  ],
  "sources": [
    {
      "key": "source_190b4acf8d15748fe80e4cb1aeffe27d2fd850282661f59d618c6576e41781af",
      "canonicalUrl": "https://example.com/source",
      "title": "Discovered source",
      "language": "en"
    }
  ],
  "findings": []
}
