{
  "contractVersion": "orion.research.v1",
  "researchRunId": "11111111-1111-4111-8111-111111111111",
  "queries": [
    {
      "query": "research methods",
      "provider": "google_news"
    }
  ],
  "sources": [
    {
      "key": "source_190b4acf8d15748fe80e4cb1aeffe27d2fd850282661f59d618c6576e41781af",
      "canonicalUrl": "https://example.com/source",
      "title": "Discovered source",
      "language": "en",
      "capture": {
        "fetchedAt": "2026-10-29T00:00:00Z",
        "extractedText": "Café 😀\nEvidence from captured bytes.",
        "raw": {
          "storageUri": "s3://test-captures/captures/11111111-1111-4111-8111-111111111111/aaaaaaaaaaaaaaaaaaaaaaaaaaaaaaaa/209707acf2f22446bc09a074d9f23a708c58b952f13b9a3c95dc78546e4e6339?versionId=fixture-version",
          "sha256": "209707acf2f22446bc09a074d9f23a708c58b952f13b9a3c95dc78546e4e6339"
        },
        "chunks": [
          {
            "index": 0,
            "text": "Café 😀\nEvidence from captured bytes.",
            "startOffset": 0,
            "endOffset": 36
          }
        ],
        "metadata": {
          "extractor": "visible_html_nfc_lf_v1",
          "final_url": "https://example.com/source"
        }
      }
    }
  ],
  "findings": []
}
